{
  "schema_version": "pptx-studio-brief-normalized.v1",
  "brief_id": "hospital-finance-digital-upgrade-2026",
  "audience": "某市中心医院院务会（院长、分管副院长、总会计师、信息与采购负责人）",
  "purpose": "获得数智化升级项目立项及进入采购准备的决策",
  "delivery_context": "15 分钟院务会立项汇报，10 分钟问答",
  "facts": [
    {"fact_id": "f01", "value": "2025 年结算业务量同比增长 18%，现有人工对账链路已成为月末瓶颈。"},
    {"fact_id": "f02", "value": "月末结算平均周期为 9.6 个工作日，其中跨系统核对占 42% 的人工工时。"},
    {"fact_id": "f03", "value": "抽样发现 7 类高频差异项，重复追溯导致临床、医保与财务三方沟通延迟。"},
    {"fact_id": "f04", "value": "方案建设统一数据底座、规则引擎与经营驾驶舱，覆盖收费、结算、成本和预算预警。"},
    {"fact_id": "f05", "value": "第一阶段优先上线结算核对与异常预警，6 个月内形成可量化试运行成果。"},
    {"fact_id": "f06", "value": "项目采用财务牵头、信息中心共建、临床科室联络员参与的治理机制。"},
    {"fact_id": "f07", "value": "预计总投资 1,800 万元，其中平台建设 980 万元、接口治理 420 万元、培训与试运行 400 万元。"},
    {"fact_id": "f08", "value": "预期结算周期缩短 30%，高频差异自动识别率达到 85%，预算异常预警提前至月中。"},
    {"fact_id": "f09", "value": "主要风险为数据口径不一致、临床协同不足和采购周期；分别由财务、信息中心和采购部门负责闭环。"},
    {"fact_id": "f10", "value": "建议 2026 年 1 月完成立项，2—3 月完成采购准备，4 月启动第一阶段，9 月提交试运行评估。"},
    {"fact_id": "f11", "value": "汇报目录。"}
  ],
  "assets": [],
  "constraints": [
    "蓝绿低饱和、专业医疗金融视觉", "数据、流程和结论均须可编辑", "不使用无关图库人物或产品截图"
  ],
  "assumptions": [
    "当前阶段无额外品牌手册", "客户提供的数据为立项测算口径，最终采购预算以审批为准"
  ]
}
